{
  "$schema": "https://json-schema.org/draft/2020-12/schema",
  "$id": "https://sessionreviewer.local/schemas/machine-ledger-v4.schema.json",
  "title": "SessionReviewer machine ledger v4",
  "$comment": "Runtime validators additionally enforce a non-branching, acyclic pricing supersession graph, identical provider/session/usage identity across each edge, and at most one selected effective leaf per usage record.",
  "type": "object", "additionalProperties": false,
  "required": ["schema_version", "minimum_reader_version", "minimum_writer_version", "project_id", "generation_id", "project_view_digest", "accepted_revision", "review_sha256", "history_sha256", "accounting", "sessions", "human_patches", "orphan_patches", "generated_baselines", "pricing_snapshots", "current_pricing_snapshot_ids", "sync_hashes"],
  "properties": {
    "schema_version": { "const": 4 }, "minimum_reader_version": { "enum": ["0.4.0", "0.4.1", "0.4.3"] }, "minimum_writer_version": { "enum": ["0.4.0", "0.4.1", "0.4.3"] }, "project_id": { "$ref": "#/$defs/id" }, "generation_id": { "$ref": "#/$defs/id" }, "project_view_digest": { "$ref": "#/$defs/digest" }, "accepted_revision": { "type": "integer", "minimum": 0, "maximum": 9007199254740991 }, "review_sha256": { "$ref": "#/$defs/sha256" }, "history_sha256": { "$ref": "#/$defs/sha256" },
    "accounting": { "$ref": "#/$defs/accounting" }, "sessions": { "type": "array", "maxItems": 65536, "items": { "$ref": "#/$defs/session" } },
    "human_patches": { "type": "array", "maxItems": 65536, "items": { "$ref": "#/$defs/patch" } }, "orphan_patches": { "type": "array", "maxItems": 65536, "items": { "$ref": "#/$defs/patch" } }, "generated_baselines": { "type": "array", "maxItems": 65536, "items": { "$ref": "#/$defs/baseline" } },
    "pricing_snapshots": { "type": "array", "maxItems": 65536, "items": { "$ref": "#/$defs/snapshot" } }, "current_pricing_snapshot_ids": { "$ref": "#/$defs/id_array" }, "document_projection": { "$ref": "#/$defs/document_projection" }, "sync_hashes": { "$ref": "#/$defs/sync_hashes" }
  },
  "allOf": [
    { "if": { "required": ["document_projection"] }, "then": { "properties": { "minimum_reader_version": { "enum": ["0.4.1", "0.4.3"] }, "minimum_writer_version": { "enum": ["0.4.1", "0.4.3"] } } }, "else": { "properties": { "minimum_reader_version": { "const": "0.4.0" }, "minimum_writer_version": { "const": "0.4.0" } } } },
    { "if": { "properties": { "minimum_reader_version": { "const": "0.4.3" } }, "required": ["minimum_reader_version"] }, "then": { "properties": { "minimum_writer_version": { "const": "0.4.3" }, "document_projection": { "properties": { "presentation_base": { "properties": { "minimum_reader_version": { "const": "0.4.3" }, "minimum_writer_version": { "const": "0.4.3" } } } } } } }, "else": { "if": { "required": ["document_projection"] }, "then": { "properties": { "minimum_reader_version": { "const": "0.4.1" }, "minimum_writer_version": { "const": "0.4.1" }, "document_projection": { "properties": { "presentation_base": { "properties": { "minimum_reader_version": { "const": "0.4.0" }, "minimum_writer_version": { "const": "0.4.0" } } } } } } } } }
  ],
  "$defs": {
    "id": { "type": "string", "minLength": 1, "maxLength": 256, "pattern": "^[A-Za-z0-9][A-Za-z0-9._:-]*$" }, "text": { "type": "string", "maxLength": 16384 }, "digest": { "type": "string", "pattern": "^sha256:[0-9a-f]{64}$" }, "sha256": { "type": "string", "pattern": "^[0-9a-f]{64}$" }, "timestamp": { "type": "string", "maxLength": 128 }, "nonnegative": { "type": "integer", "minimum": 0, "maximum": 9007199254740991 }, "id_array": { "type": "array", "maxItems": 65536, "items": { "$ref": "#/$defs/id" } },
    "accounting": { "type": "object", "additionalProperties": false, "required": ["total_duration_ms", "total_tokens", "total_cost_usd", "models"], "properties": { "total_duration_ms": { "$ref": "#/$defs/nonnegative" }, "total_tokens": { "$ref": "#/$defs/nonnegative" }, "total_cost_usd": { "type": ["number", "null"], "minimum": 0 }, "models": { "type": "array", "maxItems": 256, "items": { "$ref": "#/$defs/model" } } } },
    "model": { "type": "object", "additionalProperties": false, "required": ["model", "total_tokens", "total_cost_usd"], "properties": { "model": { "$ref": "#/$defs/text" }, "total_tokens": { "$ref": "#/$defs/nonnegative" }, "total_cost_usd": { "type": ["number", "null"], "minimum": 0 } } },
    "session": { "type": "object", "additionalProperties": false, "required": ["provider", "session_id", "processing_state", "source_availability", "session_view_digest", "usage_record_digest"], "properties": { "provider": { "$ref": "#/$defs/id" }, "session_id": { "$ref": "#/$defs/id" }, "processing_state": { "enum": ["complete", "partial", "error", "unprocessed"] }, "source_availability": { "enum": ["available", "unavailable"] }, "session_view_digest": { "type": ["string", "null"], "pattern": "^sha256:[0-9a-f]{64}$" }, "usage_record_digest": { "type": ["string", "null"], "pattern": "^sha256:[0-9a-f]{64}$" } } },
    "patch": { "type": "object", "additionalProperties": false, "required": ["entity_id", "field", "operation", "base_generated_hash"], "properties": { "entity_id": { "$ref": "#/$defs/id" }, "field": { "$ref": "#/$defs/id" }, "operation": { "enum": ["set", "suppress", "restore_default"] }, "value": { "$ref": "#/$defs/text" }, "values": { "type": "array", "maxItems": 256, "items": { "$ref": "#/$defs/text" } }, "base_generated_hash": { "$ref": "#/$defs/sha256" } } },
    "baseline": { "type": "object", "additionalProperties": false, "required": ["generation_id", "entity_id", "field", "kind", "generated_hash"], "properties": { "generation_id": { "$ref": "#/$defs/id" }, "entity_id": { "$ref": "#/$defs/id" }, "field": { "$ref": "#/$defs/id" }, "kind": { "$ref": "#/$defs/id" }, "value": { "$ref": "#/$defs/text" }, "values": { "type": "array", "maxItems": 256, "items": { "$ref": "#/$defs/text" } }, "generated_hash": { "$ref": "#/$defs/sha256" } } },
    "snapshot": { "$ref": "https://sessionreviewer.local/schemas/pricing-snapshot-v1.schema.json" },
    "document_projection": { "type": "object", "additionalProperties": false, "required": ["schema_version", "format", "presentation_base"], "properties": { "schema_version": { "const": 1 }, "format": { "const": "review-markdown-v1" }, "presentation_base": { "$ref": "https://sessionreviewer.local/schemas/review-presentation-v4.schema.json" } } },
    "sync_hashes": { "type": "object", "additionalProperties": false, "required": ["review_sha256", "history_sha256", "ledger_sha256", "session_index_digest"], "properties": { "review_sha256": { "$ref": "#/$defs/sha256" }, "history_sha256": { "$ref": "#/$defs/sha256" }, "ledger_sha256": { "$ref": "#/$defs/sha256" }, "session_index_digest": { "$ref": "#/$defs/digest" } } }
  }
}
