{"schema_version":4,"minimum_reader_version":"0.4.0","minimum_writer_version":"0.4.0","project_id":"project-compatibility","generation_id":"generation-compatibility","project_view_digest":"sha256:1111111111111111111111111111111111111111111111111111111111111111","accepted_revision":3,"review_sha256":"1beabc6a697b1003cdcac4088767ff2d54e7d82542cad94250da61963a7a117a","history_sha256":"bf48faeb4b0de73721ccc46a615aecdb3ef3fa1c497b5340f1b2ee323eaacbdd","accounting":{"total_duration_ms":0,"total_tokens":0,"total_cost_usd":null,"models":[]},"sessions":[],"human_patches":[],"orphan_patches":[],"generated_baselines":[],"pricing_snapshots":[],"current_pricing_snapshot_ids":[],"sync_hashes":{"review_sha256":"1beabc6a697b1003cdcac4088767ff2d54e7d82542cad94250da61963a7a117a","history_sha256":"bf48faeb4b0de73721ccc46a615aecdb3ef3fa1c497b5340f1b2ee323eaacbdd","ledger_sha256":"9900fe4a1da57f615199530d2698eb214cd3858e646c3f57006bae1375417ea9","session_index_digest":"sha256:6a5328670e7430258bb5d6ba0208b5e72d2cd3a6cf78b0c69e824ecb65f74f6a"}}