{
  "schema_version": 4,
  "minimum_reader_version": "0.4.1",
  "minimum_writer_version": "0.4.1",
  "project_id": "project-p",
  "generation_id": "generation-1",
  "project_view_digest": "sha256:1111111111111111111111111111111111111111111111111111111111111111",
  "accepted_revision": 1,
  "review_sha256": "2639bc9326abf3464fe726c58108fb11a86d47dd16d13bb393ca465c83f65b09",
  "history_sha256": "46efc1a50523fc7fc2a5f77e6fae15eea065cf8d7ab9e9a72d8fb06fa5046258",
  "accounting": {
    "total_duration_ms": 0,
    "total_tokens": 0,
    "total_cost_usd": null,
    "models": []
  },
  "sessions": [],
  "human_patches": [],
  "orphan_patches": [],
  "generated_baselines": [],
  "pricing_snapshots": [],
  "current_pricing_snapshot_ids": [],
  "document_projection": {
    "schema_version": 1,
    "format": "review-markdown-v1",
    "presentation_base": {
      "generated_baselines": [],
      "orphan_patches": [],
      "human_patches": [],
      "chain_dependencies": [],
      "problem_nodes": [
        {
          "revision": 1,
          "confirmed_at": "2026-09-05T00:00:00Z",
          "sibling_order": 0,
          "first_proposed_at": "2026-09-05T00:00:00Z",
          "provenance": "human_created",
          "source_turn_refs": [],
          "current_conclusion": "使用封闭字段目录。",
          "completion_criterion": "24 个字段归属均唯一。",
          "answer_state": "answered_unverified",
          "workflow_state": "in_progress",
          "related_node_ids": [],
          "primary_parent_id": null,
          "question": "如何确保同一字段只有一个权威位置？",
          "id": "problem:alpha"
        }
      ],
      "problem_root_ids": [
        "problem:alpha"
      ],
      "problem_map_revision": 1,
      "open_loops": [
        {
          "completion_criterion": "未改区域哈希一致。",
          "next_experiment": "构造 CRLF/LF 交错夹具。",
          "question": "混合换行文档如何保持未改字节？",
          "status": "open",
          "title": "CRLF 保留",
          "id": "loop:alpha"
        }
      ],
      "risks": [
        {
          "detail": "未修改区域若被 pretty-print 会产生噪声。",
          "status": "open",
          "title": "无损性回归",
          "id": "risk:alpha"
        }
      ],
      "decisions": [
        {
          "revision": 1,
          "pinned": true,
          "provenance": "human_created",
          "session_refs": [],
          "milestone_ids": [
            "milestone:alpha"
          ],
          "supersedes": [],
          "reevaluate_when": "当无损往返无法保证时。",
          "legacy_status_text": null,
          "status": "active",
          "impact": "编辑不再依赖 JSON。",
          "rationale": "正文应可直接阅读，\n同时保持机器账本封闭。",
          "title": "选择 [Markdown] 作为人工编辑面。",
          "occurred_at": "2026-09-05T00:00:00Z",
          "kind": "decision",
          "id": "decision:alpha"
        }
      ],
      "timeline": [
        {
          "closed_loop": {
            "coverage": {
              "source_unavailable_turns": 0,
              "truncated_turns": 0,
              "captured_turns": 0,
              "source_turns": 0
            },
            "source_turn_refs": [],
            "impact_and_follow_up": {
              "source_turn_refs": [],
              "missing_reason": null,
              "text": "下一步：\n- 实现 lexer\n- 验证往返\n",
              "state": "present"
            },
            "verification": {
              "source_turn_refs": [],
              "missing_reason": "not_verified",
              "text": "",
              "state": "missing"
            },
            "execution": {
              "source_turn_refs": [],
              "missing_reason": "no_execution_evidence",
              "text": "",
              "state": "missing"
            },
            "conclusion": {
              "source_turn_refs": [],
              "missing_reason": null,
              "text": "人工字段可编辑，结构仍需显式操作。",
              "kind": "human_confirmed"
            },
            "trigger_question": {
              "source_turn_refs": [],
              "missing_reason": "not_captured",
              "text": "",
              "state": "missing"
            }
          },
          "decision_ids": [
            "decision:alpha"
          ],
          "summary": "目录、版本组合与基线绑定已定义。",
          "title": "冻结 Markdown 合同",
          "kind": "milestone",
          "occurred_at": "2026-09-05T00:00:00Z",
          "generation_id": "generation-1",
          "id": "milestone:alpha"
        }
      ],
      "current_state": {
        "last_verification": "",
        "next_action": "运行聚焦测试。\n\n```sh\ngo test ./internal/reviewv4\n```",
        "status": "active",
        "stage": "  实施阶段",
        "goal": "项目目标夹具"
      },
      "revision": 1,
      "project_view_digest": "sha256:1111111111111111111111111111111111111111111111111111111111111111",
      "generation_id": "generation-1",
      "project_id": "project-p",
      "minimum_writer_version": "0.4.0",
      "minimum_reader_version": "0.4.0",
      "schema_version": 4
    }
  },
  "sync_hashes": {
    "review_sha256": "2639bc9326abf3464fe726c58108fb11a86d47dd16d13bb393ca465c83f65b09",
    "history_sha256": "46efc1a50523fc7fc2a5f77e6fae15eea065cf8d7ab9e9a72d8fb06fa5046258",
    "ledger_sha256": "7f88cfc54caf84e0e58224916815530ed6ed18f156e57f1c9ea7102bd67888c5",
    "session_index_digest": "sha256:473d1dc1e8ebe67d6d14af9793c3272e0e78bc98b8c00c2cff2ba68111dc3565"
  }
}
