{"schema_version":4,"minimum_reader_version":"0.4.0","minimum_writer_version":"0.4.0","project_id":"project-compatibility","generation_id":"generation-compatibility","project_view_digest":"sha256:1111111111111111111111111111111111111111111111111111111111111111","accepted_revision":3,"review_sha256":"a63d11b41586032ff1ed76020a520e51b95f1e7d9851b96a402455acbf2000d4","history_sha256":"bf48faeb4b0de73721ccc46a615aecdb3ef3fa1c497b5340f1b2ee323eaacbdd","accounting":{"total_duration_ms":0,"total_tokens":0,"total_cost_usd":null,"models":[]},"sessions":[],"human_patches":[],"orphan_patches":[],"generated_baselines":[],"pricing_snapshots":[],"current_pricing_snapshot_ids":[],"sync_hashes":{"review_sha256":"a63d11b41586032ff1ed76020a520e51b95f1e7d9851b96a402455acbf2000d4","history_sha256":"bf48faeb4b0de73721ccc46a615aecdb3ef3fa1c497b5340f1b2ee323eaacbdd","ledger_sha256":"f4f61cd8e805ed82aa25f1fbeeaeb67baa838352567409e26036b99dda3ce88c","session_index_digest":"sha256:6a5328670e7430258bb5d6ba0208b5e72d2cd3a6cf78b0c69e824ecb65f74f6a"}}